{
  "schema_version": "research_packet.v1",
  "id": "how-judo-became-brazilian-jiu-jitsu-research",
  "episode_id": "how-judo-became-brazilian-jiu-jitsu",
  "title": "How Judo Became Brazilian Jiu-Jitsu — Research Gate Packet",
  "thesis": "Brazilian jiu-jitsu is better explained as a documented transnational transformation than as one uncontested handoff from one teacher to one family.",
  "status": "ready_for_review",
  "sources": [
    {
      "id": "source-ijf-kano-history",
      "title": "History — Jigoro Kano and the Kodokan",
      "source_kind": "authoritative_secondary",
      "locator": "History page, paragraphs covering 1882 and Kodokan synthesis",
      "url": "https://www.ijf.org/history/judo-corner/130",
      "publisher": "International Judo Federation",
      "accessed_at": "2026-07-30",
      "independence_group": "international-judo-federation",
      "source_quality": 4,
      "role": "factual",
      "is_factual_source": true,
      "factual_eligible": true,
      "render_eligible": false
    },
    {
      "id": "source-tsukuba-kano",
      "title": "Dr. KANO Jigoro, The Pioneer of Judo",
      "source_kind": "authoritative_secondary",
      "locator": "Education through Judo",
      "url": "https://www.tsukuba.ac.jp/en/about/history/kano/index.html",
      "publisher": "University of Tsukuba",
      "accessed_at": "2026-07-30",
      "independence_group": "university-of-tsukuba",
      "source_quality": 4,
      "role": "factual",
      "is_factual_source": true,
      "factual_eligible": true,
      "render_eligible": false
    },
    {
      "id": "source-cairus-2011",
      "title": "Modernization, Nationalism and the Elite: the Genesis of Brazilian jiu-jitsu, 1905–1920",
      "source_kind": "scholarly",
      "locator": "Tempo e Argumento 3(2), sections Round 1 and Transnational Encounters",
      "url": "https://doi.org/10.5965/2175180303022011100",
      "author": "José Cairus",
      "publisher": "Tempo e Argumento",
      "publication_date": "2011",
      "accessed_at": "2026-07-30",
      "independence_group": "cairus-2011",
      "source_quality": 4,
      "role": "factual",
      "is_factual_source": true,
      "factual_eligible": true,
      "render_eligible": false
    },
    {
      "id": "source-stanlei-brazil-judo",
      "title": "As origens do judô brasileiro: a árvore genealógica dos medalhistas olímpicos",
      "source_kind": "scholarly",
      "locator": "Introduction and Brazilian genealogy discussion",
      "url": "https://www.scielo.br/j/rbefe/a/rsrMqNqf8TRqKZdHtRsbB4f/",
      "publisher": "Revista Brasileira de Educação Física e Esporte / SciELO",
      "publication_date": "2013",
      "accessed_at": "2026-07-30",
      "independence_group": "stanlei-brazil-judo-study",
      "source_quality": 4,
      "role": "factual",
      "is_factual_source": true,
      "factual_eligible": true,
      "render_eligible": false
    },
    {
      "id": "source-cairus-2020",
      "title": "Nationalism, Immigration and Identity: The Gracies and the Making of Brazilian Jiu-Jitsu, 1934–1943",
      "source_kind": "scholarly",
      "locator": "Abstract and analysis of the 1934–1943 transformation",
      "url": "https://doi.org/10.18573/mas.105",
      "author": "José Cairus",
      "publisher": "Martial Arts Studies",
      "publication_date": "2020",
      "accessed_at": "2026-07-30",
      "independence_group": "cairus-2020",
      "source_quality": 4,
      "role": "factual",
      "is_factual_source": true,
      "factual_eligible": true,
      "render_eligible": false
    },
    {
      "id": "source-penglase-2025",
      "title": "The Unspoken Whiteness of Brazilian Jiu-jitsu",
      "source_kind": "scholarly",
      "locator": "Discussion of pre-Maeda practice and the limits of a sole-inheritance narrative",
      "url": "https://mas.cardiffuniversitypress.org/articles/300/files/693b11b853d09.pdf",
      "author": "Ben Penglase",
      "publisher": "Martial Arts Studies",
      "publication_date": "2025",
      "accessed_at": "2026-07-30",
      "independence_group": "penglase-2025",
      "source_quality": 4,
      "role": "factual",
      "is_factual_source": true,
      "factual_eligible": true,
      "render_eligible": false
    },
    {
      "id": "source-consultant-outline",
      "title": "Operator-supplied consultant outline",
      "source_kind": "consultant_outline",
      "locator": "Local attachment retained as creative-study input only",
      "role": "consultant",
      "is_factual_source": false,
      "factual_eligible": false,
      "render_eligible": false,
      "notes": "No claim cites this source. Its scripts, prompts, voices, and factual assertions are excluded."
    }
  ],
  "citations": [
    {
      "id": "citation-ijf-1882",
      "source_id": "source-ijf-kano-history",
      "locator": "Paragraphs 104–106"
    },
    {
      "id": "citation-ijf-education",
      "source_id": "source-ijf-kano-history",
      "locator": "Paragraphs 107–120"
    },
    {
      "id": "citation-tsukuba-education",
      "source_id": "source-tsukuba-kano",
      "locator": "Education through Judo"
    },
    {
      "id": "citation-cairus-rio-1909",
      "source_id": "source-cairus-2011",
      "locator": "Round 1: Japanese jiu-jitsu versus Brazilian capoeira, Rio de Janeiro, 1909"
    },
    {
      "id": "citation-cairus-arrival",
      "source_id": "source-cairus-2011",
      "locator": "Transnational encounters: the Gracies and Mayeda"
    },
    {
      "id": "citation-cairus-training",
      "source_id": "source-cairus-2011",
      "locator": "Discussion of Carlos Gracie, Mayeda, and Jacyntho Ferro"
    },
    {
      "id": "citation-cairus-terms",
      "source_id": "source-cairus-2011",
      "locator": "Count Koma to Mayeda Otavio Mitsuyo: from vaudeville jiu-jitsu to judo"
    },
    {
      "id": "citation-stanlei-arrival",
      "source_id": "source-stanlei-brazil-judo",
      "locator": "Introduction: Maeda and Satake arrival, 14 November 1914"
    },
    {
      "id": "citation-stanlei-pioneers",
      "source_id": "source-stanlei-brazil-judo",
      "locator": "Introduction: competing accounts of earlier teachers and Japanese immigrant lineages"
    },
    {
      "id": "citation-cairus-2020-transformation",
      "source_id": "source-cairus-2020",
      "locator": "Abstract and 1934–1943 analysis"
    },
    {
      "id": "citation-penglase-pre-maeda",
      "source_id": "source-penglase-2025",
      "locator": "Discussion of pre-Maeda jiu-jitsu and other Kodokan-derived styles in Brazil"
    },
    {
      "id": "citation-penglase-inheritance",
      "source_id": "source-penglase-2025",
      "locator": "Discussion of the sole-inheritance narrative"
    }
  ],
  "claims": [
    {
      "id": "kano-founded-kodokan-1882",
      "text": "Jigoro Kano founded the Kodokan in 1882.",
      "citation_ids": [
        "citation-ijf-1882",
        "citation-tsukuba-education"
      ],
      "status": "supported",
      "narration": "The useful starting point is not a battlefield legend but an institution. In 1882, Jigoro Kano established the Kodokan. That date does not mean every older jujutsu practice vanished overnight. It marks the point at which Kano's system gained a durable home, teaching structure, and identity."
    },
    {
      "id": "kodokan-synthesized-jujutsu",
      "text": "Kodokan judo synthesized material from multiple jujutsu schools rather than preserving one school unchanged.",
      "citation_ids": [
        "citation-ijf-1882",
        "citation-tsukuba-education"
      ],
      "status": "supported",
      "narration": "Kodokan judo was already a transformation. Kano drew from multiple jujutsu schools, selected and reorganized techniques, and connected practice to a broader educational program. So the story begins with adaptation inside Japan, before the art ever reaches Brazil."
    },
    {
      "id": "kano-education-project",
      "text": "Kano framed judo as an educational project involving efficient use of energy and mutual benefit.",
      "citation_ids": [
        "citation-ijf-education",
        "citation-tsukuba-education"
      ],
      "status": "supported",
      "narration": "Kano's project was larger than a catalog of fighting moves. Institutional histories emphasize education, disciplined practice, efficient use of energy, and mutual benefit. Those ideas matter because later travelers could carry techniques, sporting rules, professional contests, or educational ideals in different proportions."
    },
    {
      "id": "labels-overlapped-abroad",
      "text": "In the early twentieth century, judo and jiu-jitsu were overlapping public labels in international demonstrations and professional fighting.",
      "citation_ids": [
        "citation-cairus-terms",
        "citation-stanlei-pioneers"
      ],
      "contested": true,
      "status": "contested",
      "qualified_narration": "Terminology was not settled. Contemporary and retrospective sources use judo, jiu-jitsu, Kano jiu-jitsu, and related spellings in overlapping ways. Accounts differ about what each public label implied, so this episode follows documented people and practices instead of treating a name as a perfectly stable technical system."
    },
    {
      "id": "jiujitsu-in-brazil-before-maeda",
      "text": "Japanese jiu-jitsu was demonstrated and discussed in Brazil before Maeda's 1914 arrival.",
      "citation_ids": [
        "citation-cairus-rio-1909",
        "citation-penglase-pre-maeda"
      ],
      "status": "supported",
      "narration": "Maeda was important, but he did not enter an empty landscape. Scholarship documents Japanese jiu-jitsu demonstrations and contests in Brazil before his arrival, including a highly publicized 1909 encounter in Rio. That earlier presence complicates any claim that Brazilian grappling history begins on one day in 1914."
    },
    {
      "id": "first-teacher-status-contested",